Date,Company,Job Title,Location,Description,Seniority,Type,Job Function,Industry,Link
2023-06-15,COBS Bread,Business Data Analyst - Hybrid Remote,"Vancouver, British Columbia, Canada","Great Place to Work Certified™




Business Data Analyst – Hybrid Remote




Reports to: Head of Data, Baker's Delight in Australia




Location: Vancouver, BC




We have an exciting, newly created opportunity for a proactive and hands-on Data Analyst who is passionate about data and enjoys championing a culture of data-driven analysis. This key role is responsible for building reporting tools and supporting business decisions through the provision of data for the purpose of global (90% Canada & 10% Australia ) enterprise reporting and data analytics. The Data Analyst will work closely with internal stakeholders and subject matter experts to elicit relevant data and information to support reporting & business insights improve efficiency and transparency of data across the organization domestically and globally.




Key responsibilities include:




Providing technical guidance in regards to best practices around data analytics, dashboards, reports and applications
Conducting and supporting peer reviews to ensure data is fit for purpose with regards to the development of Proof of Concepts, dashboards and reports
Ensuring the developed use cases will meet the Data Model, Data Analytics and Business Intelligence best practices
Acquiring and processing data from multiple sources and systems using SQL and data visualization tools such as Power BI or Tableau
Working closely with Technology Teams, internal stakeholders and SMEs to interpret data requirements, identify solutions in relation to data management, and recommend technical solutions on data elements to support business decisions
Assisting with the establishment and ongoing review and refinement of the data governance policy(s) and/or management such as data ownership, master data management and metadata management
Developing reporting strategies to complement departments reporting requirements and overall enterprise strategy
Acting as a trusted advisor to department heads, commercial and marketing analysts for their data requirements
Other duties as assigned.




Requirements




What You Bring to the Table:




7+ years' proven experience in data mining and development of data pipelines and business analysis, preferably in a Franchise or Retail environment
Post-secondary Degree with concentration in computer science, information systems, data analytics or related field
Proven experience on how to clean, join, and manipulate data using SQL to support and undertake analysis
Fluency in SQL is essential including the ability to analyze, design, develop, test, and debug reports of varying complexity
Experience in creating & maintaining dashboards using Power BI or similar.
Ability to identify opportunities for process improvement and implementation of efficiencies including synergies across countries
Advanced in MS Excel and proficient knowledge of MS Outlook and Word
Strong numerical and analytical skills, with a pragmatic approach to problem solving.
Ability to work autonomously and collaboratively within a team to discuss technical matters pertaining to issues, problems, or technical specifications
High attention to detail and organizational skills while managing multiple tasks and deadlines
Understanding of data science and/or AI/ML practices is an asset




Benefits




What’s in it for You:
Not only do we have fresh COBS Bread product delivered daily to our Vancouver Support Office, we offer some pretty sweet perks too!
A flexible hybrid work arrangement and a one-time work from home reimbursement to ensure you're set up for success
Competitive salary, bonus and vacation plan
A great Extended Health & Dental Benefit, Group RRSP Matching, and Health Spending Account
Paid sick, mental health and personal leave days
Paid day for community service or volunteer opportunity
Subsidized wellness program and an on-site gym facility
An open, ‘continuous-learning’ environment where professional development and career progression is encouraged
Work within a dynamic, driven, high-achieving, close-knit and fun-loving team
High level of autonomy and responsibility
Complimentary self-serve kitchen of fresh produce, deli meats and of course, COBS Bread and treats!




We thank all applicants for their interest in COBS Bread but would like to advise that only applicants shortlisted for interview will be contacted.




We are an equal opportunity employer and value diversity at our company.




About COBS Bread




With over 160 locations, COBS Bread serves fresh and delightful baked goods to communities across Canada. Any unsold items are donated daily to various local charities and food banks. The company's success can be attributed to the quality of our product, the development of our people and our warm and friendly customer service.




COBS Bread is part of Bakers Delight – Established in 1980 operating as Bakers Delight in Australia and New Zealand, and since 2003 as COBS Bread in Canada and the USA. Together we have grown to more than 700 bakeries across Australia, New Zealand, Canada and the USA. The entire network employs over 15,000 people, serving more than 2.1 million customers each week.




Accessibility




Accommodation is available upon request for applicants and employees with disabilities. If you are contacted for a job opportunity, please advise us of any accommodations needed to ensure you have access to a fair and equitable process. Any information received relating to accommodation will be addressed confidentially.",não declarado,não declarado,não declarado,não declarado,https://ca.linkedin.com/jobs/view/business-data-analyst-hybrid-remote-at-cobs-bread-3637230137?refId=GQgKVwg%2BR0%2BeAHoV0sfbVQ%3D%3D&trackingId=Y8CbtDsj7bOxUQ2T4fU%2FPw%3D%3D&position=6&pageNum=0&trk=public_jobs_jserp-result_search-card
2023-06-21,Lynx Air,Data Analyst,"Calgary, Alberta, Canada","Are you excited about the prospect of joining a startup organization?



Interested in being a part of the changing skies in Canada and beyond?



Want to work with world-class leaders who have extensive industry know-how?



Curious about how it feels to contribute and join Canada’s newest airline while redefining affordable air travel?



If so, we have an exciting opportunity for you!



We are seeking a Data Analyst for our IT team to join our rapidly expanding, dynamic organization!



WHO WE ARE:



Let your career fly with Lynx Air, Canada's newest ultra-affordable airline. Our mission is to make air travel accessible for all, by offering low-cost, safe and customer-first flying experiences. With airfares sky-high in Canada, we're here to change the game!



Our brand-new fleet of Boeing 737 MAX planes will take Canadians to select Canadian and USA destinations at an ultra-affordable price point and we're excited to be building our team that will help us get there. With backing from prominent investors, we're poised to revolutionize the Canadian airline industry.



Join our team and be part of the changing skies of Canadian aviation!



WHAT THE ROLE ENTAILS:



Reporting to the Data Engineer, the Data Analyst will be responsible to collect, analyze, and present data across business units to assist other team members and leadership in making sound decisions.



WHAT YOU WILL BE DOING:



Build reporting, data analytics, and other strategies that optimize statistical efficiency and quality to support the business
Interpret data, analyze results using statistical techniques and provide ongoing reports
Acquire data from primary or secondary data sources and maintain databases/data systems
Identify, analyze, and interpret trends or patterns in complex data sets
Filter and “clean” data by reviewing computer reports, printouts, and performance indicators to locate and correct code problems
Work with management to prioritize business and information needs
Locate and define new process improvement opportunities
Ensure stored data is easily accessible to internal teams
Respond to inquiries and requests for information from staff in a timely manner
Work closely with leadership teams to create data strategies that support data modeling
Identify opportunities to work cross-functionally
Build strong and influential internal relationships to help ensure business objectives are being met
Remove corrupted data and review through root cause analysis

WHAT YOU BRING TO THE ROLE:



Proven working experience as a Data Analyst
BS in Mathematics, Economics, Computer Science, Information Management or Statistics
Strong knowledge of and experience with reporting packages (Business Objects etc), databases (SQL etc), and programming (XML, Javascript, or ETL frameworks)
Knowledge of statistics and experience using statistical packages for analyzing datasets (Excel, SPSS, SAS etc)
Strong analytical skills with the ability to collect, organize, analyze, and disseminate significant amounts of information with attention to detail and accuracy
Adept at queries, report writing and presenting findings
Familiarity with data visualizations and analtics tools such as PowerBI
Ability to be work independently and able to work on teams cross-functionally
Ability to organize, prioritize and follow through with important projects
Strong attention to detail
Exceptional written and oral communication skills
Ability to problem-solve with a track record of producing results
Exceptional time management skills
Ability to present complex information in a simplified way to various audience

WHAT YOU WILL GET FROM US:



Industry competitive salary
The chance to be part of building something from the ground up. Aggressive growth plans of the organization mean there is no limit to how far you can grow your career with the organization
An environment that promotes a healthy work-life balance
Open and collaborative work environment. You bring your great ideas, and we will put them to action
Comprehensive benefits plan including dental, vision, and paramedical coverage
The opportunity to travel where we fly. Not only do you get to travel standby on our airline, but we allow you to share that privilege with 6 unrestricted designates

We're an Equal Employment Opportunity employer that places value on the strength that diversity brings to the workplace and that prohibits discrimination or harassment of any kind. Our employment decisions are based on business needs, job requirements, and individual qualifications without regard to race, colour, religion, gender, sexual orientation, marital status, gender identity or expression, national origin, age, disability status, or any other characteristic protected by applicable law. We encourage all applicants who meet the requirements for the role to apply.



Interviews will be commencing right away, so don’t hesitate and apply today to be part of Canada’s changing aviation landscape! Cover letters are not required.

",não declarado,não declarado,não declarado,não declarado,https://ca.linkedin.com/jobs/view/data-analyst-at-lynx-air-3637636522?refId=GQgKVwg%2BR0%2BeAHoV0sfbVQ%3D%3D&trackingId=zg4HdbLsh8949v5nkUivcA%3D%3D&position=7&pageNum=0&trk=public_jobs_jserp-result_search-card
2023-05-23,Avison Young,Data Analyst,"Mississauga, Ontario, Canada","About You




You are a high achiever looking to thrive in a fast-paced environment. You take pride in your own work but are comfortable collaborating with a team of highly motivated individuals. You can communicate clearly and concisely with teammates and clients, and you enjoy strong company culture and camaraderie. You can navigate multiple corporate functions, including global lines of service and corporate centers of excellence. You possess strong interpersonal skills and are willing to take on diverse tasks to achieve the team’s common goal. You value personal and professional growth and are ready to take the next step in advancing your career.




If this sounds like you, well, then you will love the culture at Avison Young!




About Us




Avison Young is a global commercial real estate brokerage and advisory firm, offering transaction, management, financial and consulting services. We’ve designed our corporate structure to best serve our clients by enhancing collaboration across our organization.




Real estate can have an enormous positive impact on people’s lives – and we’re in the business of making spaces and places work better for people. Our purpose is to create real economic, social and environmental value as a global real estate advisor, powered by people.




We care about each other and we have each other’s backs. This makes Avison Young a great place to be a client, and a great place to work. We support the whole person and their complete wellness – economic, mental and physical – because what’s best for our business comes from our people bringing their whole selves to work.




Of course we love it here, but outsiders think we’re pretty great too Avison Young was awarded the prestigious America’s Best Midsize Employers for 2022, presented by Forbes and Statista, Inc. We’re proud to be regularly recognized for our team, services and culture and our team members enjoy comprehensive compensation and benefit programs. Through our customized work options, we give our people the flexibility to create a work environment that puts their overall well-being first. After all, we are powered by people.




As a Data Analyst you will work closely with internal and external stakeholders in local markets across all business lines. Leveraging your passion for cities and real estate, you will capture, review and enhance micro data resulting from daily real estate market activities.




This newly created role which will require an initial period of upfront data entry, will soon evolve into the analyst role which will see a typical day split between
reviewing products daily and ensuring that core real estate data recently added to platform including properties, images, documents, companies, leases, sales and availabilities appear complete, consistent, high quality and are displaying correctly
reviewing functionality daily to ensure processes and interactions involving data work seamlessly
engage with local resources to capture and enhance real estate data on properties, companies, availabilities, leases, sales
reading news on local city, business, economic, company, infrastructure, demographic and real estate market activity
meeting/speaking with both internal and external stakeholders around market activities
updating status of properties under construction and enhancing data on property, tenants and ownership
adding/updating data on platform utilizing publications, public filings, public records and third-party data providers
reading, abstracting and adding data from industryspecific websites, newsletters and publications and company and investor websites, newsletters, public filings and investor presentations
searching and pulling data from public records around ownership, sales, debt, permits, zoning and tax assessments
adding/updating and structuring data related to property attributes such as ceiling heights, column spacing and amenities, leases such as rents, incentives, headcounts and expirations
availabilities and touring activity
adding/maintaining data from internal systems and processes by reaching out to industry insiders to track down missing data points such as
Property data - status, original construction and renovation dates, architect, developer
Company data - industry, headcount, revenue and locations
Availability data - status, size, timing, rent, incentives and buildout
Lease data - size and date based on availabilities being removed from system; following up by utilizing technology and algorithms and reaching out to populate full details
Sale data - transaction type, yields, buyers and sellers and ensuring sale links to correct property
assisting division team members by ensuring documents loaded are fully abstracted and that marketing materials, rent rolls and stacking plans are added to properties




To be successful in this role, an individual must be able to perform each essential task at an above average level. The requirements listed below are representative of the knowledge, skill and/or ability required.




Bachelor’s Degree required
1+ year experience in commercial real estate or real estate course work preferred
Passionate about cities and real estate
Dedicated to data as an art and science
Sound knowledge of the GTA is preferred
Advanced knowledge of Microsoft excel preferred
Possess characteristic traits of independent thinking, self-starting initiative while working well in a team-oriented environment
Must be able to handle flexibility in task management while having a keen eye for detail
Ability to communicate clearly and concisely is essential
Ability to multi-task, utilize effective time management skills, and be able to recognize and respond to time sensitive issues and tasks




A positive attitude is essential as we strive to maintain and protect our culture by hiring only those that enhance our current compliment of long-term employees and bring value to our team.




Avison Young practices as an equal opportunity employer in all services locations around the world. We are committed to building and maintaining a workforce diverse in experience, skills and knowledge with uniformity in service excellence, commitment and integrity.




The firm maintains a strict policy to ensure employment opportunities are equal and do not discriminate based on race, color, religion, creed, age, sex, gender, gender identity or expression, sexual orientation, national origin, citizenship, disability, marital and civil partnership/union status, protected veteran or military service status, or any other elements protected by law.




For those requiring assistance with disabilities, information relating to the need for accommodation and accommodation measures will be addressed confidentially.




Avison Young is committed to employing the best talent with the most fair and equitable recruitment practices. Apply with us TODAY!",não declarado,não declarado,não declarado,não declarado,https://ca.linkedin.com/jobs/view/data-analyst-at-avison-young-3615703540?refId=GQgKVwg%2BR0%2BeAHoV0sfbVQ%3D%3D&trackingId=ze99dWn9DMPD2WeyfqbJXQ%3D%3D&position=8&pageNum=0&trk=public_jobs_jserp-result_search-card
2023-06-17,Vancity,Data Analyst Co-op,"Vancouver, British Columbia, Canada","Data Analyst Co op

As member of Technology team within Data Platform group, you will analyze requirements and support in building data solutions for projects and operational requests. You will learn industry standard data Integrations that contribute enhancements and support strategic business initiatives.

Vancity is the largest private sector Living Wage Employer in Canada and have been consistently recognized as one of the Top Employers in Canada. Come join our team of 2,600 diverse individuals and access competitive rewards & benefits, all while knowing you are a part of a greater movement.

This competitively rewarded role will enjoy hybrid working arrangements which can be fulfilled primarily from the Vancity head office location and your Lower Mainland based home office. Periodically, in-person events or activities will be required of you. September - May Co-op.

The Role

Data Analyst will work alongside the Data Platform team:

Organize requests and support the team for deliverables using Azure DevOps
Analyze data requests and support building data integrations using Azure Data Factory pipelines
Troubleshoot and resolve problems of data services that support business & applications systems and provide solutions to pro-actively prevent problems from happening.
Help drive transformation by continuously looking for ways to automate existing processes and optimize for efficiency and data quality

You Are

Curious – ask questions, challenge assumptions and discover new insights
Creative – we encourage you to think about how you might share information in new and creative ways
Comfortable with ambiguity – we are focused on continuous improvement and always seeking ways to work more effectively and efficiently
Solutions oriented – you have a growth mindset and approach new and challenging situations with a “how might we” attitude
Excited to learn

You Have

A current GPA of 3.00 or higher
Excellent written and visual communications
A passion for sharing information in new and creative ways
A goal of achieving a bachelor’s degree in Business, Communications, or a related field
Willingness to work in a highly flexible environment with multiple competing priorities

Bonus Points, If You Have

Knowledge of, at least one modern programming language in Data solutions: Pyspark, Scala Spark
Certifications / Knowledge in using Azure data stack

The Team

In this role, you will report into Manager, Data Platform

At Vancity we’re committed to creating a welcoming and inclusive workplace to help our people and communities thrive and prosper. Diversity in our workforce is integral so that we can truly represent, understand and respond to our community needs and deliver on our member experience.

As part of this commitment we are taking action to learn more about our applicants and ask that you complete a short and anonymous Diversity Survey that will influence the design and execution of Vancity’s overall DEI initiatives and programs, one of which aims to advance our commitment to become a financial force for change and build a fair world. Please click this hyperlink to complete the Diversity Survey. Your responses are collected anonymously and will never be linked to your job application.

At Vancity we’re dedicated to being an inclusive, anti-racist organization with a workforce that reflects the diversity of the communities we serve.

Vancity is an inclusive and equitable employer and actively seeks to advance racial equity, inclusion and belonging across the organization. Vancity offers required accommodations in all stages of the recruitment process.  If you require an accommodation, please advise us, and we will work with you to meet your needs.

Please note that all shortlisted candidates for this role will be required to complete a background check which includes resume verification, credit check, criminal record check.",não declarado,não declarado,não declarado,não declarado,https://ca.linkedin.com/jobs/view/data-analyst-co-op-at-vancity-3636752153?refId=GQgKVwg%2BR0%2BeAHoV0sfbVQ%3D%3D&trackingId=lNtWAHeod3cAt3fwAWQDDw%3D%3D&position=9&pageNum=0&trk=public_jobs_jserp-result_search-card
