Date,Company,Job Title,Location,Description,Seniority,Type,Job Function,Industry,Link
2023-03-29,Canadian Tire Corporation,Data Analyst,"Toronto, Ontario, Canada","Please note that your application will be considered for the current and future hiring opportunities within this job posting




What You’ll Do




We are seeking an experienced Data Analyst to join our team. The Data Analyst will play a critical role on the Digital Competition and Customer Insights team, reporting into the manager of this function. This team works on strategic projects personalized customer experiences across CTC. This is a high-visibility role that often supports the Senior Executive team and collaborates with other across functional teams in the organization. You understand the importance of data integrity. With an “automate first” mindset, you have the skills and abilities to formulate actionable insights for business stakeholders and to synthesize information across a broad ecosystem to enable data-driven decision making. You are a team player with strong communication skills and with a collaborative spirit. You’re able to network on all levels and have a genuine curiosity that grows your understanding of projects. In this role, you will:




Be responsible for the management and handling of data
Query, extract and transform raw data from multiple data warehouses to conduct key insight and in-depth analysis of customer interactions across various channels
Develop reporting dashboards to translate complex data into actionable insights across the organization
Identify and troubleshoot technical issues as they arise with an entrepreneurial mindset, and provide scalable resolution with follow-through
Steer ad-hoc projects that leverage multiple sources of data such as web analytics, loyalty amongst several other data sources
Partner with IT and business stakeholders to influence decision-making with data




What You Bring




B.S. in Engineering, Science, Mathematics, Statistics or Computer Science.
2+ years of professional work experience in data domain
Advance knowledge of SQL to perform complex data analysis
Experience with Data intelligence and visualization platforms such as Looker, Google Data Studio, Tableau or other tools
Experience using Excel
Ability to translate business requirements into technical analytical specifications
Balance of technical and business acumen, including modeling and strategic business case development
Bonus points if you have experience with:
Python or another language to transform and process data
GCP data technologies (Google Cloud, Big Query), experience with other cloud databases such as Snowflake
Data intelligence and visualization platforms such as Looker, Google Data Studio, Tableau or other tools




Hybrid




We value flexibility. We have adopted a hybrid work model whereby employees use a combination of working in office and virtually in service of outcomes. Each leader is empowered to decide what work is best achieved in person based on the unique needs of their team.




About Us




Canadian Tire Corporation, Limited (“CTC”) is one of Canada’s most admired and trusted companies. With more than 90 Owned Brands, 1,700 retail locations, financial services, exemplary e-commerce capabilities, and exciting market-leading merchandising strategies. We dream big and work as one to innovate with purpose for our customers at every level of our business, investing in new technologies and products, and doubling down on top talent to drive the company forward. We offer competitive salaries and wages to CTC employees, as well as store discounts, supported learning through our Triangle Learning Academy, Canadian Tire Profit Sharing, and retirement and savings programs for eligible employees. As part of our enhanced flex benefits program, we offer mental health benefits in the amount of $5,000 per year for benefits-eligible employees and their families, including total well-being, and mental health tools and resources for all employees. Join us in helping to make life in Canada better through living and working our Core Values: we are innovators and entrepreneurs at our core, outcomes drive us, inclusion is a must, we are stronger together and we take personal responsibility. It is an especially exciting time to join CTC and its family of companies where career opportunities are wide-ranging! Join us, where there's a place for you here.




Our Commitment to Diversity, Inclusion and Belonging




We are committed to fostering an environment where belonging thrives, and diversity, inclusion and equity are infused into everything we do. We believe in building an organizational culture where people are consistently treated with dignity while respecting individual religion, nationality, gender, race, age, perceived ability, spoken language, sexual orientation, and identification. We are united in our purpose of being here to help make life in Canada better.




Accommodations




We stand firm in our Core Value that inclusion is a must. We welcome and encourage candidates from equity-seeking groups such as people who identify as racialized, Indigenous, 2SLGBTQIA+, women, people with disabilities, and beyond. Should you require any accommodation in applying for this role, or throughout the interview process, please make them known when contacted and we will work with you to help meet your needs.


",não declarado,não declarado,não declarado,não declarado,https://ca.linkedin.com/jobs/view/data-analyst-at-canadian-tire-corporation-3575855951?refId=GQgKVwg%2BR0%2BeAHoV0sfbVQ%3D%3D&trackingId=0%2F98BXRDu0i1tLPPPvc51Q%3D%3D&position=10&pageNum=0&trk=public_jobs_jserp-result_search-card
2023-06-22,TekWissen ®,Data Analyst,"Montreal, Quebec, Canada","Position: Data Analyst

Location: Montréal QC H3A 2A6

Duration: 12 Months

Job Type: Contract

Work Type: Onsite

Pay Rate:$80-$80/hr

Job Description:

Principal Duties:

Review, understand, interpret and transform clearly defined technical specifications into data warehouse, database and/or business intelligence solutions
Perform detailed data analysis (i.e. determine the structure, content, and quality of the data through examination of source systems and data samples)
Perform problem analysis, structured analysis, design and programming techniques
Use Data Modeling, Database Query Optimization and Data Access techniques and concepts
Use Database knowledge in areas of import and export, users, roles, privileges, schema and object management, session monitoring, etc.
Code, maintain, test and provide code reviews for developed processes and procedures (e.g. queries, scripts, stored procedures, database objects, indices, triggers, etc.)
Apply strong performance tuning knowledge in SQL to interpret plans, identify bottlenecks in queries and remediate them
Apply strong knowledge in Python and Shell Scripting required for file processing and database connections
Work proactively to solve issues and problems
Create use cases and assist in UAT testing efforts for the developed solutions
Document, effectively track and resolve issues in a timely manner during the development and testing phases (work with the team and end users as appropriate)
Provide weekly progress reports of work performed
Work with the project team to assist in other aspects of the project
Follow and adhere to BNP Paribas development standards, the software development lifecycle, vendor application / project standards and guidelines
Embrace the opportunity to take on special projects outside of specific roles and responsibilities
Closely interact with onshore stakeholders and onshore teams on a regular basis.

Contributing Responsibilities

Contribute towards knowledge sharing initiatives across the team
Contribute towards Innovation and Creativity initiatives across the team and the organization.

Technical & Behavioral Competencies

Oracle: SQL, PL/SQL (Mandatory)
Unix Scripting
Python Scripting
Java/JavaScript
T-SQL, MS SQL
Oracle: Warehouse Builder, Data Integrator
Good working knowledge of data warehouse, database and business intelligence environments, concepts and techniques Good understanding of SDLC processes.
Good understanding of concepts and techniques for design, development and implementation of ETL and data quality
Strong coordination and organizational skills.
Excellent communication skills (written and verbal) with the ability to explain complex issues in a simple concise manner
Smooth communication with business users and be able to withstand the pressure.
Multi-tasking capabilities.

Specific Qualifications

Organizational skills

Ability to collaborate / Teamwork
Attention to detail / rigor
Communication skills - oral & written

Transversal Skills:

Analytical Ability
Ability to develop and adapt a process
Ability to understand explain and support change
Ability to develop and leverage networks
Choose an item.

Education Level:

Bachelor Degree or equivalent

Experience Level,

At least 3 years",não declarado,não declarado,não declarado,não declarado,https://ca.linkedin.com/jobs/view/data-analyst-at-tekwissen-%C2%AE-3638808779?refId=GQgKVwg%2BR0%2BeAHoV0sfbVQ%3D%3D&trackingId=cspy2%2FMaAmE1yBAWZPKvbg%3D%3D&position=11&pageNum=0&trk=public_jobs_jserp-result_search-card
2023-05-19,Tanamera Construction,Data Analyst,Canada,"Tanamera is a full-service residential and commercial development and construction company headquartered in Reno, Nevada. Tanamera is the outgrowth of several development and construction companies all founded by Kreg Rowe, Tanamera's founder, and Managing Partner, that have been developing and building residential and commercial projects in northern Nevada since 1995.




The Role




Your Responsibilities Will Include




Managing the GL reporting and processing of journals.
Maintaining fixed assets register.
Liaising with AR/AP teams on month-end closing activities.
Timely and accurate month-end closing and monthly reporting.
Liaising with auditors and preparing audit schedules.




Ideal Profile




Skills Required




You ideally possess a CFA qualification.
You have at least 1-year experience, ideally within a Data Analyst, Chief Data Officer / Head of Data Science or Accountant (General Ledger) role.
You pay strong attention to detail and deliver work that is of a high standard
You possess strong analytical skills and are comfortable dealing with numerical data
You are a self-starter and demonstrate a high level of resilience




What's on Offer?




Leadership Role
Work alongside & learn from best in class talent
Join a market leader within Pharmaceutical & Biotech",não declarado,não declarado,não declarado,não declarado,https://ca.linkedin.com/jobs/view/data-analyst-at-tanamera-construction-3633347263?refId=GQgKVwg%2BR0%2BeAHoV0sfbVQ%3D%3D&trackingId=Cm7kJ8dCl9dTW1NKWpFr2Q%3D%3D&position=12&pageNum=0&trk=public_jobs_jserp-result_search-card
2023-03-31,American Iron & Metal (AIM),Data Analyst,"Montréal-Est, Quebec, Canada","Company Description




Become a part of AIM’s growing success.




American Iron & Metal (AIM) is a recognized global leader in the metal recycling industry, with more than 125 site locations and 3500 employees worldwide. We have continued to prosper for the last eight decades (we just celebrated our 86th birthday!) thanks to the dedication of our employees and the ongoing trust and support of our customers.




Become part of team AIM, a growing team who has over the years, successfully evolved into a multifaceted company with business divisions that include metal recycling (AIM Recycling), construction waste recycling (AIM Eco-Centre), manufacturing of solder assemblies (AIM Solder), demolition and decommissioning (AIM Delsan) and auto-recycling (Kenny U-Pull). We take pride in doing good things for the environment to help create a greener, more sustainable future for all.




It’s simple; we do it right. We AIM for excellence.




What we offer!




Competitive salary + other perks
Group insurance & RRSP program
Company-wide events throughout the year (BBQ, Holiday party etc.)
Free gym on site
Two cafeterias on site (subsidized meal program available)
Dynamic & rewarding work environment- work on high-impact, meaningful projects while also having fun!




Job Description




Duties/Responsibilities:




Assesses market strategies by analyzing related products, markets, or trends.
Maintains current knowledge of industry and business trends through communication with professional organizations, suppliers, customers, competitors, and other informed individuals.
Devise, develop, and deploy required data queries in response to business user needs.
In conjunction with data owners and department managers, develop data models and protocols for mining production databases.
Assist in the development of data management policies and procedures.
Identify research questions, problem solve using data analysis, and communicate the results to various stakeholders
Work with application development staff to coordinate the creation and management of data queries.
Collaborate with unit managers, end users, development staff, and other stakeholders to integrate data management applications with existing systems.
Provide and apply quality assurance best practices for data analysis services across the organization.
Develop, implement, and maintain change control and testing processes for modifications to data models.
Create data definitions for new database file/table development and/or changes to existing ones.
Determine required network components to ensure data access, as well as data consistency and integrity.
Develop routines for end users to facilitate best-practice use of data management tools.
Collaborate with database and disaster recovery administrators to ensure effective protection and integrity of data assets.
Monitor data management system details within the database, including stored procedures and execution time, and implement efficiency improvements.




Qualifications




Required Skills/Abilities:




Excellent verbal and written communication skills.
Proficient in Microsoft Office Suite or related software.
Ability to collect and compile relevant data.
Extremely organized with great attention to detail.
Excellent ability to analyze information and think systematically.
Strong business analysis skills.
Works well independently and as part of a team.
Thorough understanding of the company’s business processes and the industry at large.
Ability to handle databases and understand technology-driven business intelligence tools.




Education and Experience:




Bachelor’s degree in business, Management, Economics, Accounting, Finance, or Computer and Information Science required; Masters degree preferred.
7+ years of experience in data modelling and analytics.




Additional Information




American Iron & Metal and its subsidiaries is an equal opportunity employer. All qualified applicants are given consideration regardless of race, religion, colour, gender, sex, age, sexual orientation, gender identity, national origin, marital status, citizenship status, disability, veteran status, or any other protected class as provided in applicable employment laws. 




Although we’d love to be able to speak with everyone that applies, due to the volume of applicants we receive and time constraints, only those selected to move forward will be contacted. ",não declarado,não declarado,não declarado,não declarado,https://ca.linkedin.com/jobs/view/data-analyst-at-american-iron-metal-aim-3581174210?refId=GQgKVwg%2BR0%2BeAHoV0sfbVQ%3D%3D&trackingId=DudtjF67eImm4TZ3UFOLIA%3D%3D&position=13&pageNum=0&trk=public_jobs_jserp-result_search-card
2023-06-22,Trioworld,Junior Data Analyst - Part Time,"Mississauga, Ontario, Canada","We are looking for people passionate about data and motivated by solving problems in a dynamic, fast-paced work environment. Trioworld is a fast-growing technology company, where Research Analysts have abundant opportunities for learning and career advancement. As an early member of our team, you will play a vital role in shaping Trioworlds Data and Research team and be part of an exciting journey to modernize the $10 trillion dollar global real estate investment industry.




Here are some of the things youll spend your time doing:




Analyze, interpret and extract data from financial models (Excel and Argus), Offering Memorandums and/or any other documents




Collect, normalize, validate and structure incoming data




Support the Customer Success team with data migration when onboarding new clients




Ad-hoc data and research projects




Requirements




Requirements




Strong analytical skills and attention to detail




Advanced proficiency with Excel




Great communication and time management skills




Ability to work independently and proactively in a fast-paced, relatively unstructured environment




Accurate typing and data entry skills




Benefits




The salary for this role is between $35,000 to $45,000 depending on experience level - we will assess this during the interview process. In addition, we offer health coverage (with a health care spending account) and an annual education stipend.




Employment Type: Part-Time




Salary: $ 35,000.00 45,000.00",não declarado,não declarado,não declarado,não declarado,https://ca.linkedin.com/jobs/view/junior-data-analyst-part-time-at-trioworld-3643134170?refId=GQgKVwg%2BR0%2BeAHoV0sfbVQ%3D%3D&trackingId=wfIgipoKRPnmmRgTmuFtZQ%3D%3D&position=14&pageNum=0&trk=public_jobs_jserp-result_search-card
2023-06-20,Petroplan,Data Management - Data Analyst II,"British Columbia, Canada","JOB ROLES AND RESPONSIBILITIES:
Describe the scope and complexity of the work by listing key accountabilities and outcomes of the position
- Monthly production allocation support for field operations and Production Delivery team
- Daily reporting support for Field Operations and EC teams
- Support to Production Delivery team (PE, FE, ALS) in building/maintaining, troubleshoot and optimizing analytics and reporting tools with regards to artificial lift systems associated plunger lift, gas lift, etc.
- Workflow support - Well Losses, Well Testing process, Well sampling, Field plant balance
- Coordinate and provide yearly regulatory documentation as required
- Project Management and coordinating tool development with IT and Analytics

QUALIFICATIONS: education, professional designations Competencies:

Minimum Requirements:
* Legally authorized to work in the Canada without restrictions
* Preferred Certified Engineering Technologist
* Background in Data Analytics

HSE Competencies: any HSE competencies required to ensure the appropriate level of training and verification is present to meet Minimum Regulatory Requirements

Training: any learning resources that supports programs, procedures, critical procedures and other tools or system that is not covered in training associated to the HSE competencies but is specifically required to support the individual to carry out their regular job responsibilities in a safe and effective manner

* Commitment to HSE and technical excellence
* Positive attitude and team player
* Strong data analytics and computer skills
* Good understanding and experience in downhole completions and interventions
* Good analytical and problem-solving skills
* Strong organizational and time management skills
* Experience as a Production Technologist / Analyst is preferred
* Experience in unconventional well operations is preferred
* Able to communicate information and obtain alignment across multiple disciplines
* Proven collaboration skills with both field operations and other technical staff
* Delivers results through realistic planning
* Able to make timely decisions based on available information




About Petroplan


Petroplan is the trusted, specialist global Talent Solutions partner of choice for employers and professionals in the Energy sector. Since 1976, Petroplan has been here to help people like you make the most of the opportunities available and find the best fit for you as an individual.






Over 10,000 placements in more than 55 countries for over 550 clients across 65 disciplines.






In an industry where skilled and experienced professionals are increasingly sought after resource, we appreciate the true value of what you have to offer. What's more, we understand that different things are important to different people in today's world of work - it's about making exactly the right connections for you as an individual.






Our reputation for contractor and candidate care, understanding what makes you tick, and finding you the best match is second-to-none. We understand the industry inside-out and seek to understand YOU and your motivations in the same way. We take the time to evaluate your individual strengths, understand the most important things to you, and establish exactly what you're looking for from your next role.

",não declarado,não declarado,não declarado,não declarado,https://ca.linkedin.com/jobs/view/data-management-data-analyst-ii-at-petroplan-3641222084?refId=GQgKVwg%2BR0%2BeAHoV0sfbVQ%3D%3D&trackingId=q1DMgwQHB15Z7cCtRd6xuQ%3D%3D&position=15&pageNum=0&trk=public_jobs_jserp-result_search-card
