Date,Company,Job Title,Location,Description,Seniority,Type,Job Function,Industry,Link
2023-06-17,Hotspex Media,Analytics Intern,"Toronto, Ontario, Canada","Join Hotspex Media!

🏆 Named to Ad Age's Best Places to Work 2023

🎉 103rd Fastest Growing Company in North America, Deloitte Fast 500

🙌 #1 Ranked Media Buying and Planning Agency on Clutch.co

🔥 Highly Commended for 'Best Buy Side Innovation', 2022 Drum Awards

Key Responsibilities:

Learn how to best translate client tagging requirements into functional specifications within various tag management platforms.
Create platform tags and support with conversion tracking.
Suggest supplemental or alternative tracking points within web experiences.
Identify data collection issues within analytics dashboards and help build out stories of how campaigns performed.
Provide ongoing tag management support to internal team membrs
Work collaboratively within analytics team to deliver analytics projects.


Strategic Expectations:

Identify gaps or new opportunities within current tagging implementations and reporting and help to resolve or explore them further.
Stay up to date on digital media trends and new opportunities.


Skills and Requirements:

Basic knowledge of website architecture (HTML, CSS, JS)
Experience with or willingness to learn tag management platforms (Google Tag Manager, Telium, Adobe Launch, etc)
Experience with or willingness to learn advertising platforms (Google Ads, Meta, DV360, Pinterest, etc)
Proficiency with Microsoft Office Suite or Google Workspace or equivalent as well as Slack
Experience with SQL and Python is considered a plus, though not required
An effective and proactive approach to problem-solving
Excellent written and verbal communicator
Collaborative team-player yet comfortable with independent work


The Interview Process:
Intro Call (15-20 minutes)
Past Experience Deep Dive (45 minutes)
In parallel to this round, we'll speak with your references.
Final Round Interview (30-45 minutes)
This round is largely focused on meeting the leaders you'd be collaborating with and meeting more members of the team.

Benefits:

Competitive Salary
RRSP Matching
Generous Equipment Budgets: get what you need to be productive.
Work From Home: many of our team members work from home, but come into the office as you'd like!
Globetrotter: For up to six weeks every year, you can work anywhere you'd like as part of our 'Globetrotter' remote work policy.
Benefits + Wellness: enjoy a comprehensive package that includes a health spending account that you can use at your discretion.
3 Weeks Vacation: take time off when you need it! We also close during the holiday break.
Extended Long Weekends: for each statutory holiday, we'll close our office and extend the holiday to a 4-day weekend.


Our Values:

We know our people are what allows us to achieve all that we do and that’s why it’s important that everyone we bring onto our team lives our values with us.

Give A Sh!t: we learn nonstop because we love what we do. Because we love what we do, we do it extremely well
Got Your Back: we take care of each other. We support one another. We build each other up. There is no culture without great people.
Yes Before No: we are solution focused. We are flexible, inquisitive and positive. Any innovation must start with yes.
Inclusive: we seek differing opinions. We ensure all voices are heard. We are strong when we are different.
We’ve Got Guts: we empower change. We step outside our comfort zone and bring our teammates with us. We have tough conversations. We ask to be challenged. We listen.


Hotspex Media Inc. is an equal opportunity employer and values diversity in its workforce.",não declarado,não declarado,não declarado,não declarado,https://ca.linkedin.com/jobs/view/analytics-intern-at-hotspex-media-3638908089?refId=GQgKVwg%2BR0%2BeAHoV0sfbVQ%3D%3D&trackingId=vwBR3qbm8vQg%2Fn0GQVtsgQ%3D%3D&position=21&pageNum=0&trk=public_jobs_jserp-result_search-card
2023-06-21,Ottawa Police Service,Data Analyst,"Ottawa, Ontario, Canada","Competition Number: 2022-5307




Applications will be accepted until 2359hrs on 05/08/2023.




Posting Details




This posting is for 1 (one) temporary position for a period of 2 (two) years starting July 2023. All civilian competitions include the possibility of extension and/or additional temporary or permanent positions.




Salary Information: $84,411.60 - $99,399.30 annually. (2023 rates of pay)




All applications must be received on time and through the online application system. Applicants are required to upload their cover letter and resume in addition to the candidate profile. The cover letter should clearly outline your qualifications for this position.




More information about our hiring process can be found on the website under the Hiring Process menu.




Job Information




Directorate: Strategy & Communications Section: Business Performance




Pay Group: Seven (7) - Under Review Job Code: 10141261




Work Location: Central - 19 Fairmont Avenue




Supervisor's Title: Manager Business Performance




Effective Date: October 1, 2022




Overall Purpose




Reporting to the Manager of Business Performance, the Data Analyst is responsible for providing support and analytic advice to Senior Leadership including supporting projects that will enhance the use of data, involving complex analysis and research.




Supports the development of the organization’s data strategy, including the data collection and analysis framework.
Proactively identify analytical opportunities and provide recommendations that improve all elements of the data analysis process and increase analytical capacity throughout the organization.
Leverage advanced analytical techniques to conduct business analysis and identify meaningful insights, interpreting data and turning it into knowledge that informs tactical and strategic business decisions including analysis of current projects, programs, and policies.
Provides analytical leadership and expertise.
Maintains technical expertise through ongoing research of innovative practices and engaging with professional networks and professional associations.




This work seeks to improve the outcomes of enhancing public trust, duty of care internally and externally and to further evolve aspects of Community Safety and Well-being (CSWB) by adopting and including community co-design/co-production.




Major Responsibilities




Supports the development of the organization’s data strategy, including the data collection and analysis framework.




Provides recommendations to develop or enhance systems of data collection.
Provides statistical expertise, determining the validity of data, constructing meaningful indices, and determining the limitations of data.
Establishes standards and guidelines for data collection, modeling, and analysis to ensure consistency and accuracy.
Facilitates meetings with internal and external clients to help define analytical opportunities, provide expertise in data collection methods, and make recommendations on solutions.




Proactively identify analytical opportunities and provide recommendations that improve all elements of the data analysis process and increase analytical capacity throughout the organization.




Major Responsibilities (continued)




Leverage advanced analytical techniques to conduct business analysis and identify meaningful insights, interpreting data and turning it into knowledge that informs tactical and strategic business decisions including analysis of current projects, programs, and policies.




Identifies and documents analytics needs, records requirements, provides data insights to support narrative, and develops project plans that incorporate agile delivery practices.
Leverages advanced analytical techniques to conduct analysis and produce reports for the provision of human rights and equity analyses for senior management and the community.
Measures the effectiveness of initiatives and programs, identifies trends, emerging issues, and implications, and builds baselines against which future metrics can be measured.
Applies a user-centred development approach to build reports and dashboards employing best-practices.
Presents reports, results of analyses, and recommends data collection and analytic strategies to help advance equity in the workplace and in the community through police policies, procedures, and practices.
Expand community access to open data to increase transparency, build trust, foster innovation, and enable co-design/ co-production of improved community safety and well-being outcomes.
Liaise with related statistical agencies to ensure adherence with data analysis standards and benchmark results.




Major Responsibilities (continued)




Provides Analytical Leadership




Establishes collaborative working relationships with stakeholders/partners (Incl. the community) and acts as a change agent helping to building a continuous improvement culture.
Contributes as a subject matter expert on data analytics projects and represents the Unit / Police Service in this capacity on committees, task forces, working groups, meetings, as assigned.
Responds to routine and non-routine inquiries or requests for information from outside agencies and partners, municipalities, vendors and/or members of the public, escalating issues where appropriate.
Provides supervision, guidance, and mentoring to Analysts, researchers, and others in the organization on equity, inclusion, and human rights data collection and analysis.
Remains current with local, provincial, and national and international legislative changes or emerging good practices that impact or influence the provision of data equity or social identity data collection or analysis.
Research innovative practices relating to data collection, statistical analysis, and data visualization.




Statement Of Required Qualifications




Education




Successful completion of a four (4) year degree in Applied Statistics, Data Science, Social Sciences, Criminology, or a related discipline.
Experience and formal training combined may substitute for stipulated education requirements.




Experience




Minimum three (3) years' experience in data analysis, statistical and predictive modelling, applying a wide range of analytical techniques, exploratory data analysis or data mining processes including:




Developing and implementing quantitative and qualitative research frameworks and methodologies for large-scale projects.
Presenting data and data interpretations and insights to non-technical audiences in a clear and compelling way, using graphical representations and data visualizations.
Developing KPIs and reports from concept, development, deployment, and reporting, to metric ownership.
Operational research and program evaluations experience including statistical analysis which includes forecasting trends, identifying emerging issues, and applying critical thinking skills.
Project management experience which demonstrates the ability to foresee challenges, risks and opportunities concerning socio-demographic data collection in a policing context, lead and organize projects, troubleshoot, and solve problems creatively.
Experience with statistical and research software (ideally SPSS or R) and data visualization tools (PowerBI).




Language




English – fluency in oral, reading, and writing.




Certifications and Licences




N / A




In service Training




The following mandatory training and education is provided to all civilian employees of the OPS:




Occupational Health & Safety.
Respectful Workplace.
Harassment & Violence in the Workplace.
Accessibility for Ontarians with Disabilities Act (AODA).
Equity, Diversity & Inclusion (EDI).




Job Knowledge




General knowledge of the Organization’s Mission, Vision and Values.




Strong knowledge of data and statistical methods, tools, and operationalizing analytic models.




Advanced knowledge, skills, and proficiency in




Virtual platforms, MS Office Suite, and databases, including the use of virtual platforms for conducting meetings and/or presentations.
Relational data models and creating complex queries to transform data using PostgreSQL, Microsoft SQL, Microsoft Power BI, SQL Server BI, Python.




A demonstrated high level of initiative and the ability to be self-directed in applying problem solving and critical thinking, including a strong attention to detail.




Strong political acuity to make recommendations to senior leadership, build consensus amongst stakeholders and provide appropriate and recommendations to resolve conflict.




OPS Competencies




Competency Level Competency Level




Communication 3 Leadership 1




Teamwork 2 Planning & Organizing 2




Adaptability 2 Resource & Fiscal Management 2




Service Orientation 2 Organizational & Environmental Awareness 1




Network & Relationship Building 3 Strategic Thinking 1




Problem Solving 3




Hours of Work




Monday to Friday day shift schedule




Effort and Working Conditions




Works independently and as a team, under the general direction of the Manager, Business Performance.
Work is performed in accordance with the Ontario Human Rights Code, Anti-Racism Act, Occupational Health and Safety Act, Employment Standards Act, Accessibility for Ontarians with Disabilities Act, Youth Criminal Justice Act, Police Services Act and Municipal Freedom of Information and Protection of Privacy Act.
Subject to periods of prolonged sitting, visual and mental concentration when reading volumes of material, inputting data and when proofreading or preparing reports, presentation, or training materials; may be subjected to periods of intense concentration when analyzing metrics to make strategic recommendations.
Utilizes advanced analytical skills to research, plan and resolve technological problems associated with capturing data, using integrated computerized databases and police systems.
Organizes own assignments to ensure tasks are completed in a timely manner, while performing daily activities.
Closely collaborates business lines to coordinate and monitor the efficient capturing of data for research, analysis, surveys, academic partnerships, data governance and business intelligence.




Desired Qualifications




Experience working on projects in a large health or public safety organization is preferred.
Experience with law enforcement/policing/criminal justice system.
Experience with geospatial analysis using the ArcGIS platform., including web-based development tools such as, ESRI ArcGIS Online, ESRI ArcGIS Enterprise.




Additional Competition Information




Competition results will be valid for twelve (12) months from the date of closing. Any additional staffing requirements for the same status as the advertised competition posting, within the timelines, can be utilized to staff the position. For more information please review the Staffing Guidelines found on the Wiki.




This competition will remain open until filled.




The onus is on the candidate to clearly relate his/her qualifications to the requirements of the position as well as to provide proof of any required certification(s) / license(s), as identified in the job description. Failure to include these documents may result in the applicant being screened out of the competition.




Accommodation will be provided in all parts of the hiring process as required. Accessible formats and communication support are available upon request. Applicants need to make their needs known in advance. Please contact CivilianStaffing@ottawapolice.ca if you have any questions.",não declarado,não declarado,não declarado,não declarado,https://ca.linkedin.com/jobs/view/data-analyst-at-ottawa-police-service-3637678745?refId=GQgKVwg%2BR0%2BeAHoV0sfbVQ%3D%3D&trackingId=RiGmUk5%2B4woKdFVdBaARnA%3D%3D&position=22&pageNum=0&trk=public_jobs_jserp-result_search-card
2023-06-20,Braintrust,Marketing Data Analyst - Freelance [Remote],"Toronto, Ontario, Canada","ABOUT US:

Braintrust is a user-owned talent network that connects you with great jobs with no fees or membership costs—so you keep 100% of what you earn.

ABOUT THE HIRING PROCESS:

When you join Braintrust, you will be invited to a screening process for Braintrust to learn more about your previous work experiences. Once completed, you will have access to the employer for this role and other top companies that seek high-quality talent. Apply to this job to kick off the process.

JOB TYPE: Freelance, Contract Position (no agencies/C2C - see notes below)
LOCATION: Remote - Work from anywhere (TimeZone: CST | Full day overlap)
HOURLY RANGE: Our client is looking to pay $60 – $80/hr
ESTIMATED DURATION: 35h/week - Long term
BRAINTRUST JOB ID: 6794


THE OPPORTUNITY

Requirements:

2 to 6 years of data quality assurance experience with a concentration in email production or digital marketing department
Bachelor’s Degree in Business, Digital Marketing, Data Analytics, or related field
Knowledge of Salesforce Marketing Cloud and Salesforce CRM desired
Proven ability to manage partners & multiple projects with exceptional client-service skills
Strong analytical and problem-solving skills
Ability to adapt and adjust priorities as needed
Keen attention to detail
Familiarity of email technologies and industry best practices


What you’ll be working on

Summary:

The Marketing Data Analyst position supports the planning and execution of digital marketing

campaigns. The Marketing Data Analyst will be a liaison between the Asset Management’s marketers and deployment leads from the Global Brand Experience (GBX) team. This individual will assess campaign requirements and the data needs to support deployment. They will provide feedback of existing processes and work with the department leaders on creative solutions to drive data efficiencies. This is a 30-35 hour per week contract position.

Core Responsibilities:

Create and maintain campaign lists in Salesforce CRM and audience segmentation in Salesforce CDP
Serve as liaison between marketing and IT on issues related to data mining and our client's AM data integrity
Identify data gaps or data dependencies which may affect timelines
Ensure that email campaigns are setup in the most effective manner to extract insights and data trends
Perform data research and data quality validation for multiple data sources
Maintain documentation of our client's AM marketing data
Oversee the integrity of the data by working with colleagues to ensure the data from the various systems, and associated business processes, are fit for purpose
Serve as the primary point of contact for GBX for the customer our client's AM data sources, identifying opportunities to improve marketing systems and data management
Assist staff in accessing our client's AM data sources to support business operations
Consult on best approach to define audience through targeted lists or audience criteria
Validates campaign data setup in Salesforce Marketing Cloud to ensure audiences are set up correctly
Responsible for production support as issues arise. This individual will log the email incident and work with Marketing and GBX on resolution
Review email briefs to understand campaign purpose, audience criteria and journey mapping
Perform other duties as assigned


Apply Now!

C2C Candidates: This role is not available to C2C candidates working with an agency. If you are a professional contractor who has created an LLC/corp around their consulting practice, this is well aligned with Braintrust and we’d welcome your application.

Braintrust values the multitude of talents and perspectives that a diverse workforce brings. All qualified applicants will receive consideration for employment without regard to race, national origin, religion, age, color, sex, sexual orientation, gender identity, disability, or protected veteran status.",não declarado,não declarado,não declarado,não declarado,https://ca.linkedin.com/jobs/view/marketing-data-analyst-freelance-remote-at-braintrust-3641064579?refId=GQgKVwg%2BR0%2BeAHoV0sfbVQ%3D%3D&trackingId=JVdreHqyMB7LzuzH3CjlyQ%3D%3D&position=23&pageNum=0&trk=public_jobs_jserp-result_search-card
2023-06-22,BCforward,Senior Data Analyst,"Mississauga, Ontario, Canada","Hi Professionals,

Hope you are doing well,




We are seeking for Senior Data Warehouse/Mapping Analyst for Our Direct Client Partner.

One of the Largest Banking Client.




Must Have :

should have 10+ years of Financial Services experience

Data mapping/Data lineage/Data Warehousing projects




Role : Financial Regulatory Reporting Consultant

Location : Toronto, ON (Hybrid)




JD :




Business Analyst/Data Analyst Job Description:




About the Role:

The ideal candidate should have 10+ years of Financial Services experience as well as background in dealing with Lending/Loans systems across various line of business will be an added advantage. Experience in implementing data solutions and Knowledge of big data platform will be a significant advantage. The candidate will work closely with the product owner, Data Analysts, various technology teams, and core developers. Strong analytical, communication and stakeholder management skills are essential to be successful in this role. On the Technology perspective, the candidate should have strong SQL skills.




Responsibilities:

• Takes accountability, in partnership with technology leads, for successful delivery of designated projects to agreed schedule, scope and quality. This includes support of project delivery throughout full lifecycle, including through the SIT, UAT and migration phases.

• Establishes appropriate stakeholder engagement across Technology, Operations and Product for appropriate contributions to ensure the highest possible value-add project outcomes

• Works with the Program Manager to ensure project governance and delivery process and methodology is effective, e.g. detailed IT work and milestone plans, schedules with milestones, estimates, resource plans, reporting and clear risk and issue management.

• All required tracking artefacts are regularly updated; toolkit and systems are optimally utilized

• Applies in-depth knowledge of concepts and procedures within own area and basic knowledge of other areas to resolve issues that have impact beyond own area.

• Ensures standard procedures are followed.




Qualifications:

• Experience with Data mapping/Data lineage/Data Warehousing projects

• Experience in working on Big Data platform (Hive/Hadoop) is a huge plus

• Knowledge of various financial industry regulatory landscape

• Excellent documentation, analytical and process-based skills to produce process flow diagrams, business analysis, and functional design.

• Strong interpersonal and articulation skills (spoken and written)

• Proficiency in MS Office (Word, Excel, Visio, PowerPoint) with extensive experience using Excel for data analysis

• Experience with all phases of Software Development Life Cycle

• Comprehensive knowledge of the principles of business analysis

• Experience in Level 3 Support model adds value",não declarado,não declarado,não declarado,não declarado,https://ca.linkedin.com/jobs/view/senior-data-analyst-at-bcforward-3641818341?refId=GQgKVwg%2BR0%2BeAHoV0sfbVQ%3D%3D&trackingId=gpUN5B9zC108tp5OVqIZBg%3D%3D&position=24&pageNum=0&trk=public_jobs_jserp-result_search-card
