Date,Company,Job Title,Location,Description,Seniority,Type,Job Function,Industry,Link
2023-05-25,SinaLite,Data Analyst,"Markham, Ontario, Canada","SinaLite is a family owned business which has been operating since 1999. What started as a small 1,200 square-foot print shop which operated a single small AB-Dick printer has blossomed into a company of 150+ employees, containing several million dollars worth of printing equipment, and achieving a yearly sales revenue of 40+ million with over 20,000+ customers across North America.

Responsibilities and Duties:

General and Administrative

Communicate effectively with the Management Team, informing and updating them regularly to guarantee that company objectives and customer objectives are met.
Comply with all OHSA safety requirements.
Participate as a key player in the company by supporting operations and management as needed.
Follow systems and procedures outlined in our Procedure Manual.
Keep current on the latest technologies and software tools.
Maintain and assist in the development of appropriate departmental databases including but not limited to finance.
Assist the Management in the establishment and implementation of processes and procedures.
Other duties as assigned.


Data Analysis

Collect, process, and clean data from various sources for analysis.
Use statistical methods to analyze data and generate useful business insights.
Create data visualizations using business intelligence tools to effectively communicate findings to the team.
Identify patterns, trends, and insights in large datasets to support business decisions.
Work closely with management and teams across the company to understand their data needs and provide analytical solutions.
Maintain and manage company databases and ensure data integrity and security.
Assist in the creation and tracking of key performance indicators.
Work on data analysis projects in various departments including but not limited to marketing, manufacturing, finance, etc
Other duties as assigned.


Requirements

Bachelor's degree in Mathematics, Statistics, Computer Science, Economics, or a related field.
At least 2 years experience as a Data Analyst or similar role.
Proficiency in data analysis tools and programming languages, such as SQL, Python or R.
Extensive experience with business intelligence tools like Domo, Tableau, or PowerBI is a must.
Strong analytical mindset with the ability to collect, organize, analyze, and disseminate significant amounts of information with attention to detail and accuracy.
Excellent communication and presentation skills to effectively report findings to the team and stakeholders.
Ability to work in a team environment and collaborate across multiple departments.


Working Conditions:

Intensive computer work and extended use of the computer keyboard and mouse.
Sitting for prolonged periods of time - up to 8 hours per day.
Working remotely and in office as required at the sole discretion of the company.
Occasional lifting of objects up to 25 lbs.
Work area may have fluorescent lighting and air conditioning.
Noise level is usually moderate to loud.
Exposure to ink and chemical fumes, and airborne particles such as paper dust and drying powder.
Appearance at all times must represent the company image.
Fast-paced environment: subject to numerous schedule and priority changes and short notice activity.
Occasional additional hours may be required due to operational requirements.


Benefits

What we offer:

Employer Paid Benefits including but not limited to: Health, Dental, Life, and Vision.
Employee/ Family Assistance Program
Wellness Program
Employee Savings Program
Room for growth and advancement
Company sponsored learning
Employee appreciation events
And more!


Want to get a better sense of who we are and what we do? Check us out on Glassdoor! Review employee testimonials and employee driven content including videos and photos!;

https://www.glassdoor.ca/Overview/Working-at-SinaLite-EI_IE1520650.11,19.htm?countryRedirect=true

SinaLite is committed to providing equal employment opportunity for all persons regardless of race, sexual orientation, family status, ethnic origin, colour, sex, age, marital status and/or disability. We are committed to treating all persons with dignity, independence, integration and respect. Alternative formats of this position are available upon request.",não declarado,não declarado,não declarado,não declarado,https://ca.linkedin.com/jobs/view/data-analyst-at-sinalite-3617943583?refId=GQgKVwg%2BR0%2BeAHoV0sfbVQ%3D%3D&trackingId=0IUPtCtRx6%2BKAS48ST9KYA%3D%3D&position=1&pageNum=0&trk=public_jobs_jserp-result_search-card
2023-06-17,Cerebral,Data Analyst,"Toronto, Ontario, Canada","Our Company:




At Cerebral, we're on a mission to democratize access to high-quality mental health care for all. We believe that everyone everywhere deserves to get the care they need, and are striving to make care convenient and accessible, while tackling the stigmas that surround mental illness.




Since launching in January of 2020, Cerebral has scaled to provide mental health services to more than 700,000 people in all fifty US states. With support from investors like SoftBank, Silver Lake, Access Industries, Bill Ackman, WestCap, and others, and impactful leaders like you, we'll continue to democratize mental health care and double down on clinical quality and deliver exceptional client outcomes for years to come. With a heavy focus on clinical quality and safety in all that we do, we've accomplished excellent outcomes for hundreds of thousands of clients:




82% of clients report an improvement in their anxiety symptoms after using Cerebral.
75% of clients who report improvement in their depression see improvement within 60 days.
50% of clients who initially report suicidal ideation no longer harbor suicidal thoughts after treatment with Cerebral.




This is just the beginning for Cerebral, and we won't stop building, growing, and iterating until everyone, everywhere can access high-quality, evidence-based mental health care without high costs and/or long wait times. We're looking for mission-driven leaders who share these values, and we need your help as we transform access to high-quality mental health care in the United States and beyond.




The Role:




The Data Analyst is responsible for collecting, analyzing, and interpreting data to support the growth and development of the telehealth mental health company. The Data Analyst will work closely with stakeholders on clinical, product, operations, and engineering teams to identify and address data-driven opportunities to improve the company's products and services.




Who You Are




Bachelor's degree in data science, statistics, computer science, or a related field
2+ years of experience in data analysis
Strong analytical and problem-solving skills
Ability to translate an abstract research question into a concrete analysis plan
Excellent communication and presentation skills
Ability to work independently and as part of a team
Strong proficiency in SQL
Strong proficiency with a business intelligence tool (eg. Looker, PowerBI, Tableau, etc.)
Familiarity with Python or R
Experience in the healthcare industry is preferred
Experience with telehealth or other remote health care delivery models is preferred
Experience with mental health data or electronic healthcare data is preferred
Experience writing production code is preferred
Experience with machine learning is preferred




How your skills and passion will come to life at Cerebral:




Collect, clean, and organize data from a variety of sources, including electronic health records
Build data visualizations, dashboards, and reports
Write production code to extract, load, and transform data for downstream analytics use cases
Work with non-technical stakeholders to define, refine, and answer research questions
Analyze data using descriptive statistical techniques to identify trends, patterns, and insights
Communicate findings to non-technical stakeholders in a clear and concise manner




Who we are (our company values):




Client-first Focus - relentless focus on advancing the quality of care, clinical experience, and patient safety
Ethics & Integrity - do what is right and demonstrate ethical principles, even when no one is watching
Commitment - accountable for fully delivering on commitments to our clients and each other
Impact & Quality - make a positive impact and deliver high quality outcomes, based on data and evidence
Empathy - act compassionately, listen to seek understanding, and cultivate psychological safety with clients and colleagues
Collaboration - achieve our goals together as a united team, strengthened by mutual openness, trust, and diversity of thought
Thoughtful Innovation - continuously evolve our ability to deliver on our mission, prioritizing long-term, strategic bets over short-term gains




Cerebral is committed to bringing together humans from different backgrounds and perspectives, providing employees with a safe and welcoming work environment free of discrimination and harassment. As an equal opportunity employer, we prohibit any unlawful discrimination against a job applicant on the basis of their race, color, religion, gender, gender identity, gender expression, sexual orientation, national origin, family or parental status, disability, age, veteran status, or any other status protected by the laws or regulations in the locations where we operate. We respect the laws enforced by the EEOC and are dedicated to going above and beyond in fostering diversity across our workplace.




___________________




Cerebral, Inc. is a management services organization that provides health information technology, information management system, and non-clinical administrative support services for various medical practices, including Cerebral Medical Group, PA and its affiliated practices (CMG), who are solely responsible for providing and overseeing all clinical matters. Cerebral, Inc. does not provide healthcare services, employ any healthcare provider, own any medical practice (including CMG), or control or attempt to control any provider or the provision of any healthcare service. ""Cerebral"" is the brand name commonly used by Cerebral, Inc. and CMG.",não declarado,não declarado,não declarado,não declarado,https://ca.linkedin.com/jobs/view/data-analyst-at-cerebral-3641765247?refId=GQgKVwg%2BR0%2BeAHoV0sfbVQ%3D%3D&trackingId=k%2B3T9dkUD5xmrRyq4IbQnQ%3D%3D&position=2&pageNum=0&trk=public_jobs_jserp-result_search-card
2023-05-20,Experfy,Data Analyst - QA Tester,"Toronto, Ontario, Canada","Our client is looking for a Data Analyst to join our digital data team to ensure that the data available as-a-service in global data warehouses meets business requirement, with the right quality for enabling enterprise data and analytics and insights initiatives. Maintains the data catalog and ensure compliance of data manipulation with industry standard practices. The bulk of the work covers partnering with data engineers, data scientists and product owners for data analysis and integration requirements and guiding solution design and architecture.




Tools




Good knowledge of cloud computing. Knowing AWS is a plus
SQL, Excel, PowerPoint, Word
Tableau and Power BI for data exploration is plus
ETL tools knowledge is plus
Snowflake datamart knowledge is plus
Project management & support: JIRA projects & service desk, Confluence, Teams




Skills




Expert in Data manipulation techniques (esp. querying tables with SQL)
Strong capacity to develop consistent, clear analysis and report potential issues
Data quality audit techniques (Electronic Data Discovery)
Expert in applications and product testing
Familiarity with data science methods and scaling data science methods




Soft Skills




Pragmatic and capable of solving complex issues
Ability to understand business needs
Good communication
Service-oriented, flexible, positive team player
Self-motivated, takes initiative
Rigorous, attention to detail to map data systems
Curious to understand what is behind each data field




Experience




3 to 5 years of experience as Business Analyst/QA Tester (performed data manipulation, data analysis, master data management, application/product testing)
Experience in a healthcare company is a strong plus




Preferred Qualifications




Master’s Degree in Mathematics, Economics, Computer Science, Information Management or Statistics




Requirements




Responsibilities
Understand business data requirements and translate them into technical needs, and deliver prompt, efficient, quality service
Build and maintain the data model used in global data warehouses and solutions
Define the concepts and attributes of the data and manage the data dictionary of the tables
Keep up to date data catalog with relevant data available and their attributes
Validate quality of data and steer data quality improvement action plans
Ensure and assess data quality on global data warehouses, building KPIs (incident management, completeness of data, etc.) and setting up and automate consistency checks
Identify root causes of potential malfunctions and allocate actions to the right stakeholders
Partner with Product Owners and Data Engineers to prioritize the pipeline implementation plan
Partner with Data Engineers and Data scientists to ensure pipelines meets business requirements
Partner with data domain owner and procurement team in case of need to buy or sell data
Partner with legal team regarding GDPR and other legal requirements
Actively contribute to Data governance community
Guide solution design to meet data and integration requirements
Identify new opportunities to leverage data and to integrate data or applications to enhance business value
Coordinate with data owners to ensure data accessibility and quality
Create detailed, comprehensive, and well-structured test plans and test cases
Collaborate with Digital Quality Operations team to ensure that test plans meet regulatory/compliance requirements where applicable
Estimate, prioritize, plan and coordinate testing activities – Unit, SIT, Regression, and UAT
Design, develop and execute testing
Develop and apply testing processes for new and existing products to meet client needs",não declarado,não declarado,não declarado,não declarado,https://ca.linkedin.com/jobs/view/data-analyst-qa-tester-at-experfy-3636827237?refId=GQgKVwg%2BR0%2BeAHoV0sfbVQ%3D%3D&trackingId=7qVlYfEF6NvJy85IatXBTw%3D%3D&position=3&pageNum=0&trk=public_jobs_jserp-result_search-card
2023-05-28,Phoenix Labs,Data Analyst,"Vancouver, British Columbia, Canada","Greetings from Phoenix Labs!




Whether you're hunting behemoths with your friends in Dauntless or rekindling the magical energy of Azoria in Fae Farm, our worlds empower players to share enduring stories like never before. Around here, we believe people are the ends, not the means. It's how we strive to be a destination for developers who wish to collaborate on making timeless games enjoyed by players all over the world.




Role Summary




As a Data Analyst with Phoenix Labs' Global Publishing Team, you will operate at the forefront of creating timeless gaming experiences for players around the world. You will be responsible for analyzing massive amounts of data to inform and support our global portfolio strategy.




You will collaborate cross-functionally to elevate all facets of product development - including experimentation, marketing and live operations campaign telemetry, and be an agent for informed change though delivery of nuanced insights. You will be empowered to make a meaningful impact on our products and our players.




Responsibilities




Partner with product, publishing and marketing leads to inform the strategic direction of our games
Develop analytical and statistical models using external references and internal research data
Design experiments and provide perspective to test teams' assumptions and inform their actions
Conduct analysis and build reports on marketing, monetization and live operations campaigns, highlighting opportunities and potential improvements across various channels, partners, platforms, and markets
Share your results in dashboards and presentations




Requirements




Minimum of three years professional work experience analyzing large data sets and informing product, marketing or business strategies
Ability to convey analytical and statistical results with contextually appropriate, logical case stories
Proven experience writing SQL queries and using BI software
Visualization skills using tools such as Tableau, Looker, Power BI or QuickSight




Preferred




Background in business, economics, statistics, computer science, or marketing
Knowledge in Python or other scripting languages
Avid gamer




Who We Are




We make games because we love them, and we love the way they inspire us, bring us together, and enrich our lives. Our mosaic community of game developers is united by shared values and a desire to innovate and create new kinds of core, lifestyle, multiplayer games. Phoenix Labs has teams located in Vancouver (BC), Montreal, and San Mateo. We offer relocation + visa sponsorship for qualified candidates, as needed.",não declarado,não declarado,não declarado,não declarado,https://ca.linkedin.com/jobs/view/data-analyst-at-phoenix-labs-3641771515?refId=GQgKVwg%2BR0%2BeAHoV0sfbVQ%3D%3D&trackingId=4mDvk1iUy8k%2FphEANPU%2Bjg%3D%3D&position=4&pageNum=0&trk=public_jobs_jserp-result_search-card
2023-05-02,Stripe,"Data Analyst, Growth","Toronto, Ontario, Canada","Who we are




About Stripe




Stripe is a financial infrastructure platform for businesses. Millions of companies—from the world’s largest enterprises to the most ambitious startups—use Stripe to accept payments, grow their revenue, and accelerate new business opportunities. Our mission is to increase the GDP of the internet, and we have a staggering amount of work ahead. That means you have an unprecedented opportunity to put the global economy within everyone’s reach while doing the most important work of your career.




About The Team




At Stripe, we’re dedicated to helping millions of companies worldwide to find the financial products they need to grow their businesses. That’s why our Growth Data Science team creates intelligent data products and insights to help us deliver the right message to the right user at the right time. We collaborate with Marketing and Sales to influence the go-to-market strategy, boost product adoption, and increase user retention by making data-driven decisions at scale.




What you’ll do




We’re looking for a Data Analyst to partner with the Marketing team to measure and improve the marketing performance across channels (e.g. email, website, events, paid search) and across funnels (e.g. self-serve, sold), and generate insights to inform data-driven go-to-market strategy.




Responsibilities




Define, implement and maintain the key success metrics and operational metrics for marketing campaign performance across channels (e.g. email, website, events, paid search).
Generate insights on key trends on marketing campaign performance.
Conduct ROI analyses, and generate insights into what campaigns and channels are most effective.
Design and analyze experiments to improve user acquisition, product adoption, and spend efficiency of marketing campaigns.
Design and develop datasets that enable better understanding of marketing campaign performance, and user engagement.
Partner closely with Marketing, Sales, Finance, Engineering and Product teams to identify and address the most impactful challenges with data and analyses.




Who you are




We’re looking for someone who meets the minimum requirements to be considered for the role. If you meet these requirements, you are encouraged to apply. The preferred qualifications are a bonus, not a requirement.




Minimum Requirements




3+ years of experience in analytical roles working with large datasets.
Bachelor’s degree in a quantitative field (e.g., Statistics, Economics, Sciences, Engineering).
Proficiency in SQL and Python.
Experience with writing and debugging data pipelines using a distributed data framework (e.g. Hadoop, Spark)
Strong knowledge of statistics.
Expertise in visualization, and using data insights to deliver actionable recommendations and drive business goals.
A demonstrated ability to manage and deliver on multiple projects with a high attention to detail.
Ability to communicate results clearly and a focus on driving impact.
Experience working with cross-functional teams to deliver results.




Preferred Qualifications




Master’s degree in Mathematics, Statistics, Engineering, or a related technical field.
Experience working with Marketing and/or Growth teams.
Experience with experiment design and analysis.",não declarado,não declarado,não declarado,não declarado,https://ca.linkedin.com/jobs/view/data-analyst-growth-at-stripe-3619953535?refId=GQgKVwg%2BR0%2BeAHoV0sfbVQ%3D%3D&trackingId=1W9ejyvAJKj%2BkALE4LGyOw%3D%3D&position=5&pageNum=0&trk=public_jobs_jserp-result_search-card
